{
  "schema": "Llmrecog.ExplainResult.v2",
  "semantic_version": "0.1",
  "tool_version": "contract-fixture",
  "input": {
    "path": "test/fixtures/contracts/v0.1/valid/explicit-fact.recog",
    "document_id": "EXPLICIT_FACT",
    "digest": "sha256:50e5f549f8084d53ec348c7c1c42d908e42ecc7a2bb446f7e6fdc5ab503ad95d"
  },
  "complete": true,
  "truncated": false,
  "target": {
    "id": "E_DEPLOYMENT",
    "declaration_kind": "entity"
  },
  "recognition": {
    "declaration_kind": "entity",
    "id": "E_DEPLOYMENT",
    "type": "occurrence",
    "label": "deployment",
    "grounded_in": [{ "id": "S1", "kind": "span" }],
    "support": {
      "kind": "explicit",
      "grounded_in": [{ "id": "S1", "kind": "span" }]
    }
  },
  "support": {
    "state": "supported",
    "records": [
      {
        "kind": "explicit",
        "grounded_in": [{ "id": "S1", "kind": "span" }]
      }
    ]
  },
  "viability": null,
  "variable_resolution": null,
  "scope": null,
  "provenance": [{ "kind": "grounded_in", "from": "E_DEPLOYMENT", "to": "S1" }],
  "normalization": null,
  "source_verification": [
    {
      "source_id": "SRC",
      "verification": { "mode": "none", "state": "not_requested" }
    }
  ],
  "relevant_constraint_ids": [],
  "skipped_constraints": [],
  "derivations": [],
  "diagnostics": []
}
