{
  "schema": "Llmrecog.ExplainResult.v2",
  "semantic_version": "0.1",
  "tool_version": "contract-fixture",
  "input": {
    "path": "test/fixtures/contracts/v0.1/valid/propagated-exclusion.recog",
    "document_id": "PROPAGATED_EXCLUSION",
    "digest": "sha256:ecb935b0a4ce831e79cc5af655a34a6e6977c85729995ad4389f5b6e8befcecc"
  },
  "complete": true,
  "truncated": false,
  "target": {
    "id": "C_WEAK",
    "declaration_kind": "candidate"
  },
  "recognition": {
    "declaration_kind": "candidate",
    "id": "C_WEAK",
    "variable_id": "V_COMMITMENT",
    "value": { "kind": "symbol", "value": "weak_commitment" },
    "grounded_in": [{ "id": "S1", "kind": "span" }],
    "support": {
      "kind": "ambiguous",
      "grounded_in": [{ "id": "S1", "kind": "span" }]
    }
  },
  "support": {
    "state": "supported",
    "records": [
      {
        "kind": "ambiguous",
        "grounded_in": [{ "id": "S1", "kind": "span" }]
      }
    ]
  },
  "viability": {
    "state": "excluded",
    "witness": null,
    "reason_chain": [
      {
        "code": "RCG-RSN-201",
        "name": "one_of_single_remaining",
        "subject_id": "C_TANAKA",
        "constraint_id": "K_ACTOR",
        "inputs": ["C_TANAKA"]
      },
      {
        "code": "RCG-RSN-202",
        "name": "excludes_pair_forbidden",
        "subject_id": "C_WEAK",
        "constraint_id": "K_NOT_WEAK",
        "inputs": ["C_TANAKA"]
      },
      {
        "code": "RCG-RSN-206",
        "name": "no_satisfying_witness",
        "subject_id": "C_WEAK",
        "constraint_id": null,
        "inputs": ["K_ACTOR", "K_NOT_WEAK"]
      }
    ],
    "unknown_reasons": []
  },
  "variable_resolution": {
    "state": "resolved",
    "unknown_reasons": []
  },
  "scope": {
    "requested_variable_ids": ["V_COMMITMENT"],
    "effective_variable_ids": ["V_ACTOR", "V_COMMITMENT"],
    "limit": 100
  },
  "provenance": [
    { "kind": "grounded_in", "from": "C_WEAK", "to": "S1" },
    { "kind": "applies", "from": "C_WEAK", "to": "K_NOT_WEAK" }
  ],
  "normalization": null,
  "source_verification": [
    {
      "source_id": "SRC",
      "verification": { "mode": "none", "state": "not_requested" }
    }
  ],
  "relevant_constraint_ids": ["K_ACTOR", "K_COMMITMENT", "K_NOT_WEAK"],
  "skipped_constraints": [],
  "derivations": [
    {
      "code": "RCG-RSN-201",
      "name": "one_of_single_remaining",
      "subject_id": "C_TANAKA",
      "constraint_id": "K_ACTOR",
      "inputs": ["C_TANAKA"]
    },
    {
      "code": "RCG-RSN-202",
      "name": "excludes_pair_forbidden",
      "subject_id": "C_WEAK",
      "constraint_id": "K_NOT_WEAK",
      "inputs": ["C_TANAKA"]
    },
    {
      "code": "RCG-RSN-206",
      "name": "no_satisfying_witness",
      "subject_id": "C_WEAK",
      "constraint_id": null,
      "inputs": ["K_ACTOR", "K_NOT_WEAK"]
    }
  ],
  "diagnostics": [
    {
      "code": "RCG-CSP-002",
      "severity": "warning",
      "message": "A source-supported candidate is excluded by grounded constraints.",
      "entity_id": "C_WEAK",
      "span": null,
      "reason_data": {
        "constraint_ids": ["K_ACTOR", "K_NOT_WEAK"]
      },
      "related": []
    }
  ]
}
